google/gsoc2012/jakimushka/20001,jakimushka,Testing framework for ScummVM,ScummVM
google/gsoc2012/jak/10001,Jakob Kristoferitsch,Improve Developer Ergonomics,SilverStripe
google/gsoc2012/jakub_d/20002,Jakub Dunia,Automated Visual Verification,JBoss Community
google/gsoc2012/jceel/42003,Jakub Klama,FreeBSD/arm and FDT cleanup,FreeBSD
google/gsoc2012/jnarloch/41002,Jakub Narloch,Extend Arquillian to support Spring testing (beans and MVC controllers),JBoss Community
google/gsoc2012/jamesmrogers/45001,James Rogers,Feature Creeper and Bug Wrangler,Nmap Security Scanner
google/gsoc2012/karolovbrat/13001,Jan,Parallelization of the Particles-In-Cell simulator OpenPixi,Computational Science and Engineering at TU Wien
google/gsoc2012/jeeb/6001,Jan Ekström,LGPL Ut Video encoder,Libav
google/gsoc2012/novotnyjan/7001,Jan Novotny,Networking framework providing EventMachine compatible layer,The JRuby Project
google/gsoc2012/poeschko/15001,Jan Pöschko,Lattices,Sage Mathematical Software System
google/gsoc2012/janschejbal/16001,Jan Schejbal,Improvements to Vespucci,OpenStreetMap
google/gsoc2012/janek_warchol/18001,Janek Warchoł,LilyPond - improve Lyrics support,GNU Project
google/gsoc2012/jjeising/15001,Jannes Jeising,"OpenPrinting web site: Enhancements for printer and driver administration, in depth security review",The Linux Foundation
google/gsoc2012/jashwanth/9001,Jashwanth Reddy,LAPACK bindings for Parrot-Linear-Algebra,Parrot Foundation
google/gsoc2012/jasinthad/11001,Jasintha Kapilajith Dasanayake,OSGi Remote Services Testing framework  for ECF,The Eclipse Foundation
google/gsoc2012/jasonhrmeier/3001,Jason Meier,Templating for AContent,Inclusive Design Institute
google/gsoc2012/jwilkins/42002,Jason Wilkins,Viewport FX,Blender Foundation
google/gsoc2012/jaspal/12001,Jaspal,Template based initialization of Amazon's EC2 instances ,"Dept. of Biomedical Informatics, Emory University"
google/gsoc2012/javi_p_t/10006,JAVIERGOMEZ,Language Installation and update tool for Joomla! ,Joomla!
google/gsoc2012/jayrambhia/5001,Jay Rambhia,Automatic segregation of conveyor belt items using SimpleCV,SimpleCV
google/gsoc2012/jayant/23001,Jayant Gupta,Diagram Layout in eTrice with KIELER,The Eclipse Foundation
google/gsoc2012/wicker/10001,Jen Hanni,AVT Open Source Quadcopter Platform,Portland State University
google/gsoc2012/jpapon/5001,Jeremie Papon,Modular Interactive Application for Static and Streaming Point Cloud Data,Point Cloud Library (PCL)
google/gsoc2012/jeremyunc/8001,Jeremy,Web-based GISTEMP Map Viewer,Climate Code Foundation
google/gsoc2012/jbanks/7001,Jeremy Banks,Slide Drive Improvements (Mozilla),Mozilla
google/gsoc2012/kostko/8001,Jernej Kos,Convert core nodewatcher components to new modular backend,freifunk
google/gsoc2012/jerzyredlarski/16001,Jerzy Redlarski,Real-time raytracer written functionally in Scala,Scala Team
google/gsoc2012/jesse_h/22001,Jesse H.,Improve BSD-licensed text processing tools.,FreeBSD
google/gsoc2012/jzelenkov/17001,Jevgeni Zelenkov,"Implement a Plugin to add ""Undo"" functionality to Forge",JBoss Community
google/gsoc2012/jibeshpatra/26002,Jibesh Patra,Upload and View or Download Image or File in HTMLForm,OpenMRS
google/gsoc2012/jigar/11001,Jigar,SUPPORT FOR PIVOT TABLES IN CALLIGRA SHEETS,KDE
google/gsoc2012/jinfu/18001,Jinfu,Integrate a New Shortest Path Algorithm to pgRouting,OSGeo - Open Source Geospatial Foundation
google/gsoc2012/jingconanwang/17001,Jing Conan Wang,network malware simulation,The Honeynet Project
google/gsoc2012/jinghuang/27001,Jing Huang,Cross Container Support,Gentoo Foundation
google/gsoc2012/sosuminjok/15001,Jinwoo Lee,Particle Filter on GPU,Point Cloud Library (PCL)
google/gsoc2012/jitenmt/6001,Jiten Thakkar,Networking Dashboard,Mozilla
google/gsoc2012/joda/18001,Joachim Daiber,A database-backed core system with an  improved model for estimation of annotation probability,DBpedia Spotlight
google/gsoc2012/lvwrbr/28002,Joao Moreira,nmap integration as a scanning engine,PacketFence
google/gsoc2012/jayd3e/7003,Joe Dallago,Improve Windows Support for the Pyramid Web Framework,Python Software Foundation
google/gsoc2012/jsimon184/62002,Joe Simon,Color-Managed Printing for Krita,OpenICC
google/gsoc2012/auska1714/6001,Joel Espunya,Guifi.net integration for qMp system,freifunk
google/gsoc2012/jcody/5001,Joey Cody,Code for America: Brigade 2012 GSoC Proposal,Code for America
google/gsoc2012/josch/4001,Johannes Schauer,Port bootstrap build-ordering tool ,Debian Project 
google/gsoc2012/jfallon/8001,John Fallon,Collaboration in Visualization,Portland State University
google/gsoc2012/jsalatas/13001,John Salatas,Letter to Phoneme Conversion in sphinx4,CMUSphinx
google/gsoc2012/ghostandthemachine/8001,Jon Rose,"Lightweight Clojure editor, repl, and documentation browser",Clojure/dev
google/gsoc2012/humbert/3001,Jonas Arnfred,Debugging of Parser Combinators,Scala Team
google/gsoc2012/exxo/9001,Jonathan Calmels,IPV6 Improvement [Userland],FreeBSD
google/gsoc2012/jssolichin/13001,Jonathan Solichin,Creating a Responsive skin for XWiki,XWiki
google/gsoc2012/jonathancornelissen/16001,Jonathancornelissen,Extend RTAQ for additional high frequency time series analysis,R project for statistical computing
google/gsoc2012/juliancromarty/6001,Jooles,Paris Traceroute development,Measurement Lab
google/gsoc2012/joost/10001,Joost Verdoorn,Overhaul the Applications View,GNOME
google/gsoc2012/jordan9481/11001,Jordan Kellerstrass,Merge Concept Module ,OpenMRS
google/gsoc2012/nenjordi/37002,Jordi Ortiz,Rewrite avserver ,Libav
google/gsoc2012/vino/38001,Jorge Rodriguez,User Interface Tasklist,Blender Foundation
google/gsoc2012/josmas/3001,Jose Dominguez,AppInventor Components to pull data feeds and display them,MIT Center for Mobile Learning @ The Media Lab
google/gsoc2012/joehms22/28002,Joseph,Upgrade Dojo to bring Evergreen to the modern web.,Evergreen
google/gsoc2012/josephboudou/17001,Joseph Boudou,[ResK] Propositional resolution proof compression using sequent calculus,Computational Science and Engineering at TU Wien
google/gsoc2012/hardolaf/9001,Joseph Warner,Auth Plugin Refactoring & User Integration ,phpBB Forum Software
google/gsoc2012/j_mabrey/3001,Josh M,Migrating the Existing Web Application from PHP to Java,Differ
google/gsoc2012/joshuaalbers/8001,Joshua Albers,Streamlining Bluetooth Connectivity in Processing for Android,Processing
google/gsoc2012/joshuabeck/31002,Joshua Beck, Gnash: Implement OpenGLES2 Renderer,GNU Project
google/gsoc2012/josip_lisec/18002,Josip Lisec,CernVM Co-Pilot log analysis and visualisation,CERN SFT
google/gsoc2012/jovanka_g/35002,Jovanka,Ability to save and load virtual machine boxes ,GNOME
google/gsoc2012/jamp/20001,jpulmann,Creating python bindings to lib2Geom,Inkscape
google/gsoc2012/jrsantos/8001,JRSantos,Unit tests for the Jikes RVM,Jikes RVM
google/gsoc2012/jsandoval/19001,Juan Pablo Sandoval A.,Rizel - Multidimensional Profiler,ESUG (European Smalltalk User Group)
google/gsoc2012/fzzbt/18002,Juhani Åhman,"PySoy: Improve testing, documentation and examples",Python Software Foundation
google/gsoc2012/shante/26002,Julia ,UDF file system server,"HelenOS group at Department of Distributed and Dependable Systems, Charles University in Prague"
google/gsoc2012/juliaycheng/16001,Julia Y. Cheng, Automated Attack Community Graph Construction,The Honeynet Project
google/gsoc2012/tangkk/24001,Junqi Deng,Adding a data prefetching transformation to LLVM Polly – generating load-balanced and coarse-grain loop pipelinable code for more task level parallelism and data locality,The LLVM Compiler Infrastructure 
google/gsoc2012/justast_bc/39002,Justas Tomkus,Justas Tomkus: Particle engine for Battle For Wesnoth,Battle For Wesnoth
google/gsoc2012/jharper1/5001,Justin,Security Sandbox,Parrot Foundation
google/gsoc2012/j_grana/8001,Justin Grana,Empirical Likelihood in Statsmodels,Python Software Foundation
google/gsoc2012/norgonq/23001,Justs,MASTodon - a Java tool for the summary and visualization of large sets of phylogenetic trees.,National Evolutionary Synthesis Center
google/gsoc2012/jvoisin/54002,jvoisin,Tails Server,Electronic Frontier Foundation/The Tor Project
google/gsoc2012/jos/58002,Józef Kucia,Implement missing functions in D3DX9,Wine (a project of Software Freedom Conservancy) 
google/gsoc2012/lurimax/28001,Jørn Lomax,Fedora Audio spin,The Fedora Project
google/gsoc2012/kailaspatil/20001,Kailas,User-Specified Content Security Policy,Mozilla
google/gsoc2012/kanikagoyal/25001,Kanika Goyal,Plagiarism API improvements,Moodle
google/gsoc2012/dontulakapil/22001,kapil,Word-Level Highlighting Synchronized with TTS,Benetech
google/gsoc2012/azzurrio/20001,Karim El Husseiny,Fair Use Tool Revamping,Berkman Center for Internet & Society at Harvard University
google/gsoc2012/karolbadowski/33001,Karol Badowski,Off-Screen Particles and mass-spring models visualisation,OGRE (Object-Oriented Graphics Rendering Engine) 
google/gsoc2012/gkarthik_92/23001,Karthik,Data Visualization of Gene-Disease Links Using Graphical Networks,Crowdsourcing Biology
google/gsoc2012/kfeeney/7002,Kate Feeney,Extending App Inventor's capabilities,MIT Center for Mobile Learning @ The Media Lab
google/gsoc2012/kaviththiranga/27001,Kavith Thiranga,A Joomla Platform Library to compile and compress Javascript and CSS files,Joomla!
google/gsoc2012/klocatelli/18001,Kento Locatelli,Proposal for a new cross-platform educational application,Tux4Kids
google/gsoc2012/kpolulak/34002,Kevin Polulak,Update the RTEMS TCP/IP Stack,RTEMS Project
google/gsoc2012/kevinwuhoo/7001,Kevin Wu,A Scalable and Efficient Storage System of GeneLists and Enrichment Score Computation,Crowdsourcing Biology
google/gsoc2012/zibon_cse_du/8001,Khondoker Md. Razequl Islam,Implementation of Bidirectional Search Algorithm for PGRouting,OSGeo - Open Source Geospatial Foundation
google/gsoc2012/chachcha/9001,Khushi Chachcha,GeneMANIA plugin for MedSavant,National Resource for Network Biology (NRNB)
google/gsoc2012/nomel7/11001,Kieran,The Tahrir Project,Freenet Project Inc
google/gsoc2012/fyorl/10001,Kim Mantas,Attachment Improvements,phpBB Forum Software
google/gsoc2012/kl_7/12001,Kirill,Brining more localization capabilities to twitter-cldr-rb gem.,Twitter
google/gsoc2012/kokeroulis/18001,kokeroulis,Integrate kwin with Plasmate SDK,KDE
google/gsoc2012/tnkousik/12001,Kousik Kumar T N,Table Improvements,abiword
google/gsoc2012/krips89/26001,Kripa,2D Image Drawing Operators from VTK in PCL,Point Cloud Library (PCL)
google/gsoc2012/kristen/29001,Kristen Aw,Realistic Comet Rendering,Stellarium
google/gsoc2012/kritarth/12001,Kritarth Anand,Apache Stanbol: Entity Disambiguation,Apache Software Foundation
google/gsoc2012/krzykwas/36002,Krzysztof Kwaśniewski,Implement an RHQ agent in Python,JBoss Community
google/gsoc2012/kiryx/8001,Krzysztof Nowak,"Combat AI, Diplomacy and Personalities",Unknown Horizons and FIFE
google/gsoc2012/saila/45001,Kseniia Shumelchyk,Develop an R package interfacing the computer algebra system Maxima,R project for statistical computing
google/gsoc2012/ksenija_bestuzheva/4001,Ksenija Bestuzheva,Dynamic modelling improvements,ASCEND
google/gsoc2012/ksuzee/17001,Ksenija Slivko,Code Refactoring for Reduced Maintenance Cost,BRL-CAD
google/gsoc2012/kelwya/23001,Kun Yang,Improve our Android application sandbox (DroidBox),The Honeynet Project
google/gsoc2012/lali/16001,Lali Devamanthri,Insight Use Cases for Calendar,The Fedora Project
google/gsoc2012/lannie/4001,Lanih ,Open photosite with cool features and smartphone integration,FOSSASIA
google/gsoc2012/pushpalanka/31002,Lanka,Implement the W3C XML Digital Signatures for Widgets Specification in Apache Wookie,Apache Software Foundation
google/gsoc2012/larswassermann/23001,Lars,ARM JITer for Squeak VM,ESUG (European Smalltalk User Group)
google/gsoc2012/shocklateboy92/15001,Lasath Fernando,Message Filtering Plugin System,KDE
google/gsoc2012/lcontzen/13001,Laurent C,Creation of a new library providing models and widgets to display and choose contacts,GNOME
google/gsoc2012/lega/17002,Lega Sergey,C++11 regex support in libstdc++,GCC - GNU Compiler Collection
google/gsoc2012/t_unix/30001,Leif,Get the C backend in shape and into trunk,SWIG
google/gsoc2012/lenna/23001,Lenna Peterson,Diff My DNA: Development of a Genomic Variant Toolkit for Biopython,Open Bioinformatics Foundation
google/gsoc2012/lexmiir/56002,lexmiir,Scratch to Catroid Project Converter and Catroid as a Typeless Programming Language,Catroid Project
google/gsoc2012/light_yang/26001,light,C# Code Actions and Code Issue Inspections,Mono Project
google/gsoc2012/kulakova_lina/26001,Lina Kulakova,NTL/Univariate polynomials and factorization library,Sage Mathematical Software System
google/gsoc2012/pypt/26002,Linas Valiukas,"Media Cloud multi-language support via plug-in infrastructure, plus an automatic stemmer and a stopword list generator",Berkman Center for Internet & Society at Harvard University
google/gsoc2012/shainer/23001,Lisa,"Solid API extension for partitioning, and a Dolphin plugin to use it",KDE
google/gsoc2012/loganaden/18001,Loganaden Velvindron,Privilege Separation in DragonflyBSD,DragonFly BSD
google/gsoc2012/lorehead/36001,Loren Davis,Implement Concurrent Hash-table / Hashmap,haskell.org
google/gsoc2012/lucastdcj/37002,Lucas Castro,Joomla Translation,Joomla!
google/gsoc2012/lfzawacki/36002,Lucas Fialho Zawacki,Joystick configuration and testing applet,Wine (a project of Software Freedom Conservancy) 
google/gsoc2012/llg/25002,Lucas Lira Gomes,Social Music - Tomahawk features in Amarok,KDE
google/gsoc2012/lesteve/19001,Luis Esteve Elfau,GNSS Receiver on GNU Radio,GNU Project
google/gsoc2012/ukasz/18002,Lukas,Slow hashes,Openwall
google/gsoc2012/lukasm/11001,Lukas Meindl,CEGUI Samples Framework,WorldForge
google/gsoc2012/mokrzu/19001,Lukasz Mokrzycki,"NERD - NEuRonalDatabase, Lukasz Mokrzycki",International Neuroinformatics Coordinating Facility
google/gsoc2012/lfrisken/18001,Luke Frisken,Precision Modeling Tools,Blender Foundation
google/gsoc2012/luisgabriel/10001,Luís Gabriel Lima,QMLify Plasma widgets,KDE
google/gsoc2012/lynnewallace/14001,Lynne Wallace,Dalvik back end for the JRuby compiler,The JRuby Project
google/gsoc2012/sharan_monikantan/6001,M Sharan Kumar,improved performance regression monitoring and data storage,Drizzle
google/gsoc2012/shidash/41001,M. C. McGrath,Global General Assembly,Portland State University
google/gsoc2012/m2ym/6001,m2ym,GNU Emacs Native Profiler,GNU Project
google/gsoc2012/sza/13001,Maciej Szawłowski,Further extend Capture-HPC with possibility of detecting malicious behavior on Linux Machines,The Honeynet Project
google/gsoc2012/magdalena/12001,Magdalena Nowak,Control Panel,Wine (a project of Software Freedom Conservancy) 
google/gsoc2012/force13/69002,mahesh gondi,Android / Lightweight Webservices with Monkey,Monkey HTTP Daemon
google/gsoc2012/colorines/60002,Mai Giménez, OAuth integration,Sakai Project
google/gsoc2012/maikumori/11001,Maiku Mori,MoinMoin 2.0 Plugin System,MoinMoin Wiki
google/gsoc2012/mailson/22002,Mailson D. Lira Menezes,Tile based rendering in Okular page view,KDE
google/gsoc2012/makarov/27005,Makarov Dmitry,Text mining add-on for Orange,Orange – Data Mining Fruitful & Fun
google/gsoc2012/maker/20001,maker,Anonymous Python Application Framework,Electronic Frontier Foundation/The Tor Project
google/gsoc2012/mcsim/46002,Maksym Planeta,[HURD] Disk I/O Performance Tuning ,GNU Project
google/gsoc2012/malikb979/9001,Malik Butler,"Create an End-User Defined, Dynamic Rank Structure Within the Guild Manager",WorldForge
google/gsoc2012/malithd/15001,Malith,Implement a Collection of Integration Patterns for Synapse,Apache Software Foundation
google/gsoc2012/mananks/18001,Manan Shah,Inclusion of Attilio Meucci's implementations in ReturnAnalytics,R project for statistical computing
google/gsoc2012/mandiwangm/13001,Mandi Wang,Extend MOSES to Encompass Primitive Recursive Functions Using Fold,OpenCog Foundation
google/gsoc2012/manindra29/17001,Manindra Moharana,Sketch Assistant,Processing
google/gsoc2012/manu4543/15001,Manu Chaudhary,Enhancing Feedback module (D7),Drupal
google/gsoc2012/manuranga/18002,manuranga,A better plan/data flow visualizer for Pig,Apache Software Foundation
google/gsoc2012/mbartnic/19001,Marcin Bartnicki,Managed ILAsm and ILDasm implementations,Mono Project
google/gsoc2012/mcfoi/4001,Marco,Porting discontinued Axios Spatial Tools into uDig core 1.3,OSGeo - Open Source Geospatial Foundation
google/gsoc2012/jeko/25002,Marco Castelluccio,Native Webapps Support on Linux,Mozilla
google/gsoc2012/mcecchetti/42003,Marco Cecchetti,Enhanced Impress svg export filter,LibreOffice
google/gsoc2012/cardinot/26001,Marcos Cardinot,Reverse Interactive Graphics Reading,Scilab
google/gsoc2012/mhuewe/30003,Marcus Hüwe,osc2 client,openSUSE
google/gsoc2012/mkchmiel/16001,Marek K Chmiel,Encryption – digital signature security,Wine (a project of Software Freedom Conservancy) 
google/gsoc2012/maria_christopoulou/18001,Maria Christopoulou,"A proposal for integration of a ""Design of experiments"" module in Scilab",Scilab
google/gsoc2012/mareo/33001,Marin Hannache,Add NFS support to iPXE,iPXE
google/gsoc2012/marioh/8001,Marios Makris,LTP: Fix/Implement automated kernel/glibc tests,openSUSE
google/gsoc2012/mtibeica/27001,Marius Tibeica,Node.js Bindings,Xapian Search Engine Library
google/gsoc2012/zaki/28001,Marjan Povolni,"The worlds fastest parallelized GFF3/GTF parser in D, and an interfacing biogem plugin for Ruby",Open Bioinformatics Foundation
google/gsoc2012/cafarm/15001,Mark,Maven FOSS Repository Extension,The Fedora Project
google/gsoc2012/markflorisson88/30002,Mark Florisson,Fast Numerical Computing with Cython,Python Software Foundation
google/gsoc2012/mark_h/7001,Mark Holland,Adding functionality and aesthetic/usability improvements to the Pandroid agent.,Artica ST ( Pandora FMS )
google/gsoc2012/iam12andwhatisthis/8002,marki,Fragments for Catroid,Catroid Project
google/gsoc2012/mdim/10001,Marko Dimjašević,Model Checking Android Applications,The Java Pathfinder Team
google/gsoc2012/martas/9001,martas,Implementing puppet modules which deploy multi-tenant mediawiki ,Puppet Labs
google/gsoc2012/hundeboll/4001,Martin Hundebøll,Generic Fragmentation/Aggregation Framework for batman-adv,freifunk
google/gsoc2012/mck182/47003,Martin Klapetek,Social services integration with KDE Workspaces (Plasma Desktop & Active),KDE
google/gsoc2012/mkuettler/13001,Martin Küttler,New interface for Cantor,KDE
google/gsoc2012/maleo/5001,Martin Leopold,Debugging Tool for the Processing Development Environment,Processing
google/gsoc2012/tinchodias/24001,Martín Dias,Package management with Fuel,ESUG (European Smalltalk User Group)
google/gsoc2012/matas/24001,Matas,Improve and migrate GES ,GStreamer
google/gsoc2012/zecaurubu/8001,Mateus Araujo Borges,Sanitizer validation using symbolic execution and library cross-checking  ,The Java Pathfinder Team
google/gsoc2012/mlen/2001,Mateusz Lenik,Expanding features of Puppet's Ruby DSL,Puppet Labs
google/gsoc2012/pielas/12001,Mateusz Piękos,Swift Conversation History,XMPP Standards Foundation
google/gsoc2012/matevzmihalic/9001,Matevz Mihalic,Web shop for router kits,freifunk
google/gsoc2012/matildabernard/8001,Matilda Bernard,Integration of multiple theme based activities in the existing GCompris suite,GNOME
google/gsoc2012/matjaz_dolgan/5001,Matjaz,Equipment warehouse/inventory plugin (wlan Slovenija),freifunk
google/gsoc2012/matteo_ceccarello/8001,Matteo Ceccarello,Conformance Checker,The Java Pathfinder Team
google/gsoc2012/dudley/12001,Matteo Nardone,Mobile Application for managing the Ninux Network,Ninux.org
google/gsoc2012/mattmik/10001,Matthew Mikolay,Vinyl Pass-Through,Mixxx DJ Software
google/gsoc2012/crasx/4001,Matthew Ramir,Open education through OpenBadges,Mozilla
google/gsoc2012/matthiask/22001,Matthias K.,Complete AppStream/Software-Center,openSUSE
google/gsoc2012/matthias_meisinger/2001,Matthias Meisinger,GeoGebraTube App for multiple mobile platforms,International GeoGebra Institute
google/gsoc2012/matthieu_ensimag/26001,Matthieu,Additional performance measures and attribution functionality to PerformanceAnalytics,R project for statistical computing
google/gsoc2012/k3pm8z/32002,Matúš Kukan,Telepathy for collaboration,LibreOffice
google/gsoc2012/strohel/15001,Matěj Laitl,Statistics synchronization for pluggable devices and Last.fm,KDE
google/gsoc2012/maulikkamdar/73002,Maulik Kamdar,Reactome Pathway Summary Visualization ,Genome Informatics
google/gsoc2012/donadiomauro/4001,Mauro Donadio,AContent to ATutor Live Content Link,Inclusive Design Institute
google/gsoc2012/max_brister/23001,Max Brister,GNU Octave - Implement JIT compiling,GNU Project
google/gsoc2012/kain88/15001,Max Linke,Library Database Management,Mixxx DJ Software
google/gsoc2012/maximenicco/6001,Maxime Nicco,Implement GEGL ops,GIMP
google/gsoc2012/mhils/12001,Maximilian Hils,HoneyProxy - HTTP(S) Traffic Investigation,The Honeynet Project
google/gsoc2012/maxludvigsson/9001,Maximilian Ludvigsson,Web annotation interface,Crowdsourcing Biology
google/gsoc2012/mayankgupta2005/55002,Mayank Gupta,Improve SCORM 2004 Support In Moodle,Moodle
google/gsoc2012/mayankjuneja/33001,Mayank Juneja,"Patches, Release and Testing Automation",Systers
google/gsoc2012/mayanks43/61002,Mayank Singh,More Controller Support for PySoy,Python Software Foundation
google/gsoc2012/mdittmer/18001,mdittmer,Accelerating Haskell Application Development,haskell.org
google/gsoc2012/medivhc/35003,Medivhc,Bdbuf Improvements,RTEMS Project
google/gsoc2012/medo42/8001,Medo42,Netplay for Hedgeroid,Hedgewars Project
google/gsoc2012/m_22/18001,Meg Ford,GNOME Documents UIs for Viewing and Editing of File Metadata,GNOME
google/gsoc2012/kmitmeher/3001,Meher Vamsi,Save ggb files directly to Google Docs,International GeoGebra Institute
google/gsoc2012/mela_galea/38003,Melania Galea,Create an OpenNMS Android App,OpenNMS
google/gsoc2012/meli0306/2001,Melanie,Apps for iPad and Android,International GeoGebra Institute
google/gsoc2012/xymeng/26001,Meng Xiangyun,Port Hedgewars to web browsers using WebGL,Hedgewars Project
google/gsoc2012/kane/39001,Mesut,New Cross-Platform 3D Display Manager,BRL-CAD
google/gsoc2012/mesutcang/19007,Mesut Can Gürle,Android-based application for devices autoconfiguration,PacketFence
google/gsoc2012/mesutcank/69003,Mesutcan Kurt,Multiplayer Extension/Improvement,Unknown Horizons and FIFE
google/gsoc2012/mfronczak/13001,mfronczak,New Maltese-Arabic language pair,Apertium
google/gsoc2012/finbrein/29001,Michael Aro ,Re-implement BIRT module on top of reporting module,OpenMRS
google/gsoc2012/mdaines/16002,Michael Daines,Data Tile Service,OpenStreetMap
google/gsoc2012/mkirby91/14001,Michael Kirby,A Direct Interface Between R and Cytoscape,National Resource for Network Biology (NRNB)
google/gsoc2012/mlandis/25001,Michael Landis,Phylowood.js: Browser-based Interactive Animations of Ancestral Dispersal and Diversity Patterns,National Evolutionary Synthesis Center
google/gsoc2012/schu/10001,Michael Schubert,Finishing network support for libgit2,Git
google/gsoc2012/mtee/7001,Michael Timofejev,Search API Statistics,Drupal
google/gsoc2012/mweylandt/22001,Michael Weylandt,Improvements to xts time series visualization and subsetting,R project for statistical computing
google/gsoc2012/bitmap/18002,Michael Wiencek,Relationship Editor,MetaBrainz Foundation Inc.
google/gsoc2012/michaelz/27001,Michael Z.,Android back-end,"Pidgin, Finch, and libpurple"
google/gsoc2012/mkepka/8001,Michal Kepka,Geoserver: Publishing hierarchical spatial data in form of dynamically loaded KML,OSGeo - Open Source Geospatial Foundation
google/gsoc2012/uricamic/13001,Michal Uřičář,Bundle method solver for structured output learning,Shogun Machine Learning Toolbox
google/gsoc2012/mtjm/3001,Michał Masłowski,recutils – Add support for indexes,GNU Project
google/gsoc2012/michal_ochman/15001,Michał Ochman,Improve Behaviour Testing Framework and Test Suite,SilverStripe
google/gsoc2012/dmp/63002,Michał Poczwardowski,OBEX Filesystem In Userspace,BlueZ
google/gsoc2012/mtlee/4001,Michelle Lee,Data Visualization,Code for America
google/gsoc2012/miggaiowski/16001,Miguel Gaiowski,Virtual Image creation web interface,Debian Project 
google/gsoc2012/mihainda/6001,Miha,Client-side graphs drawing (wlan slovenia),freifunk
google/gsoc2012/noughmad/69002,Miha Čančula,Template System for KDevelop,KDE
google/gsoc2012/mbivol/19003,Mihai Bivol,Omega: Dynamic Snippets,Xapian Search Engine Library
google/gsoc2012/mihaicarabas/10001,Mihai Carabas,Add SMT/HT awareness to DragonFlyBSD scheduler,DragonFly BSD
google/gsoc2012/mihaisoloi/11001,Mihai Soloi,Distribuited mailbox indexing over HBase/HDFS,Apache Software Foundation
google/gsoc2012/miikah/29003,MiikaH,Smoke Simulator Improvements,Blender Foundation
google/gsoc2012/mikachu/10001,Mikael Magnusson,Unified Transformation Tool,GIMP
google/gsoc2012/mikalaj/18001,Mikalai Parafeniuk,Sparse Matrix-Vector multiplication(SpMV) on Hama,Apache Software Foundation
google/gsoc2012/mikel/7001,Mikel Artetxe,Make lttoolbox-java embeddable,Apertium
google/gsoc2012/refold/64002,Mikhail Glushenkov,Sandboxed builds and isolated environments for Cabal,haskell.org
google/gsoc2012/miklos1/12001,Miklós HOMOLYA,TLS (HTTPS) support in net/tnftp,The NetBSD Foundation
google/gsoc2012/milindapathirage/11001,Milinda Pathirage,Provide cloud bursting like capabilities to Airavata computational workflows integrating with Apache Whirr,Apache Software Foundation
google/gsoc2012/milos/20003,Milos Hadzic,JRuby Kilim Integration,The JRuby Project
google/gsoc2012/wumalbert/25001,Min WU,Graph Streaming,Gephi Consortium
google/gsoc2012/mssola/20001,Miquel Sabaté,Improve KDevelop Ruby Support,KDE
google/gsoc2012/mlevar/5001,Miran Levar,Multi-Target Learning for Orange,Orange – Data Mining Fruitful & Fun
google/gsoc2012/misha_bear/17002,Misha,Formalization of Correct Usage of Kernel Core API,The Linux Foundation
